{
  "kind": "review",
  "producer": "codex",
  "pr": 6853,
  "head_sha": "aaaaaaaaaaaaaaaaaaaaaaaaaaaaaaaaaaaaaaaa",
  "base_sha": "bbbbbbbbbbbbbbbbbbbbbbbbbbbbbbbbbbbbbbbb",
  "verdict": "needs_builder_fix",
  "material_observations": [
    "State builder emitted duplicate routes for same evidence input."
  ],
  "negative_checks": [
    "No diff-level correctness issue found in reviewed hunk."
  ],
  "blockers": ["state builder route conflict"],
  "next_routes": ["builder_fix", "signoff_clean"],
  "supersedes": "review-2026-04-25T10:00:00Z-abc"
}
